{
  "client": "Apollo GraphQL",
  "role": "Conteacted Web Developer",
  "startDate": "2022-01-01",
  "endDate": "2022-04-01",
  "responsibilities": [
    "Drove a full site migration from Gatsby v2 to v4",
    "Implemented a new editing experience in their existing CMS of choice for their marketing team",
    "Started the push to refactor new modules of the site to use TypeScript wherever applicable"
  ]
}
