{
  "client": "Strangelove Labs",
  "role": "Senior Web Developer",
  "startDate": "2021-07-01",
  "endDate": "2023-04-01",
  "responsibilities": [
    "Utilized modern web technologies to optimize for maintainability and accelerated development for both internal and client projects.",
    "Directed client consultations regarding feature implementation and technical feasibility on a regular basis."
  ]
}
