{
  "client": "Strangelove Labs",
  "role": "Jr. Software Engineering Manager",
  "startDate": "2023-04-01",
  "endDate": "2023-07-25",
  "responsibilities": [
    "Helped shape development cycle as company matured and the frontend team expanded to include multiple folks and projects",
    "Helped drive an annual review format forward alongside our Chief of Staff"
  ]
}
