{
  "client": "Strangelove Labs",
  "role": "Software Engineering Manager",
  "startDate": "2023-04-01",
  "endDate": "2023-07-25",
  "responsibilities": [
    "Introduced and executed the Shape Up methodology in alignment with the Head of Product, enabling streamlined project management as the company scaled and diversified its project portfolio.",
    "Spearheaded the advancement of the annual review format in collaboration with the Chief of Staff, enhancing the company's approach to performance evaluation and development."
  ]
}
